Dis No,Year,Disaster Group,Disaster Subgroup,Disaster Type,Event Name,Country,ISO,Region,Location,Start Year,Start Month,Start Day,End Year,End Month,End Day,Total Deaths,No Injured
2012-0432-IDN,2012,Natural,Hydrological,Flood,,Indonesia,IDN,South-Eastern Asia,"Parigimoutong, Kota Palu districts (Sulawesi Tengah province)",2012,8,25,2012,8,25,4,5
2012-0426-IDN,2012,Natural,Hydrological,Flood,,Indonesia,IDN,South-Eastern Asia,"Serdang Bedagai, Nias districts (Sumatra Utara province), Mamasa district (Sulawesi Barat province)",2012,11,7,2012,11,9,13,
2012-0575-IDN,2012,Natural,Hydrological,Flood,,Indonesia,IDN,South-Eastern Asia,Kota Ternate district (Maluku Utara province),2012,5,9,2012,5,9,5,20
2012-0249-IDN,2012,Natural,Hydrological,Landslide,,Indonesia,IDN,South-Eastern Asia,"Kel Karang Panjang, Kel Kudamati villages (Kota Ambon district, Malaku province)",2012,5,24,2012,5,27,20,100
2012-0250-IDN,2012,Natural,Hydrological,Landslide,,Indonesia,IDN,South-Eastern Asia,"Pangradin village (Jasinga sub-district, Bogor district, West Java province)",2012,5,24,2012,5,24,12,
2012-0131-IDN,2012,Technological,Technological,Transport accident,Superjet 100,Indonesia,IDN,South-Eastern Asia,Bogor region,2012,5,9,2012,5,9,46,
2012-0225-IDN,2012,Technological,Technological,Transport accident,Fooker F 27,Indonesia,IDN,South-Eastern Asia,Near Jakarta,2012,6,21,2012,6,21,10,
2012-0248-IDN,2012,Technological,Technological,Transport accident,,Indonesia,IDN,South-Eastern Asia,Sumatra Isl.,2012,5,1,2012,5,1,13,
2012-0221-IDN,2012,Technological,Technological,Transport accident,,Indonesia,IDN,South-Eastern Asia,Buru Island,2012,6,17,2012,6,17,58,
2012-0353-IDN,2012,Technological,Technological,Transport accident,Ferry,Indonesia,IDN,South-Eastern Asia,Borneo Isl.,2012,9,13,2012,9,13,23,
2012-0448-IDN,2012,Technological,Technological,Transport accident,,Indonesia,IDN,South-Eastern Asia,Near Sumatra,2012,9,28,2012,9,28,38,
2013-0235-IDN,2013,Natural,Geophysical,Earthquake,,Indonesia,IDN,South-Eastern Asia,"Aceh Tengah, Bener Meriah districts (Nangroe Aceh Darussalam province)",2013,7,2,2013,7,2,48,2532
2013-0063-IDN,2013,Natural,Hydrological,Flood,,Indonesia,IDN,South-Eastern Asia,"Kota Manado, Kepulauan-sangihe districts (Sulawesi Utara province), Rokanhulu district (Riau province)",2013,2,15,2013,2,22,17,
2013-0267-IDN,2013,Natural,Hydrological,Flood,,Indonesia,IDN,South-Eastern Asia,"Galala, Passo, Sirimau, Teluk Ambon, Leitimur Selatan areas (Kota Ambon district, Maluku province), Kedaton, Rajabassa, Sukabumi, Teluk Betung areas (Kota Bandarlampung district, Lampung province)",2013,7,28,2013,7,30,12,
2013-0090-BGD,2013,Natural,Meteorological,Storm,,Bangladesh,BGD,Southern Asia,"Natore, Naogaon districts (Rajshahi province)",2013,3,29,2013,3,30,2,
2013-0085-BGD,2013,Natural,Meteorological,Storm,,Bangladesh,BGD,Southern Asia,"Sadar, Akhaura, Bijoynagar areas (Brahamanbaria district, Chittagong province)",2013,3,22,2013,3,22,31,388
2013-0138-BGD,2013,Natural,Meteorological,Storm,Tropical cyclone Mahasen,Bangladesh,BGD,Southern Asia,"Patuakhali, Bhola, Barguna districts (Barisal province)",2013,5,16,2013,5,16,17,65
2013-0071-BGD,2013,Technological,Technological,Transport accident,Ferry,Bangladesh,BGD,Southern Asia,Gazaria (Munshiganj),2013,2,8,2013,2,8,14,
2013-0528-CAN,2013,Natural,Meteorological,Extreme temperature,,Canada,CAN,Northern America,"Ontario, Quebec provinces",2013,12,21,2013,12,22,10,
2013-0190-CAN,2013,Natural,Hydrological,Flood,,Canada,CAN,Northern America,"Calgary city (Division No. 6 district, Southern Alberta province)",2013,6,20,2013,6,27,4,
2013-0171-CAN,2013,Technological,Technological,Transport accident,,Canada,CAN,Northern America,Edmonton,2013,3,21,2013,3,21,,100
2013-0240-CAN,2013,Technological,Technological,Transport accident,,Canada,CAN,Northern America,Lac-Mégantic,2013,7,6,2013,7,6,47,
2013-0385-GIN,2013,Natural,Hydrological,Flood,,Guinea,GIN,Western Africa,"Dinguiraye district (Faranah province), Siguiri district (Kankan province), Macenta district (Nzerekore province)",2013,8,1,2013,8,17,,
2013-0467-GIN,2013,Technological,Technological,Industrial accident,Gold mine,Guinea,GIN,Western Africa,Near Siguiri,2013,11,19,2013,11,20,25,
2013-0020-IDN,2013,Natural,Geophysical,Earthquake,,Indonesia,IDN,South-Eastern Asia,Nangroe Aceh Darussalam province,2013,1,22,2013,1,22,1,15
2013-0436-IDN,2013,Natural,Geophysical,Earthquake,,Indonesia,IDN,South-Eastern Asia,Nangroe Aceh Darussalam province,2013,10,22,2013,10,22,1,3
2013-0542-IDN,2013,Natural,Geophysical,Volcanic activity,Mt. Sinabung,Indonesia,IDN,South-Eastern Asia,Karo district (Sumatera Utara province),2013,9,,2013,12,,,
2013-0007-IDN,2013,Natural,Hydrological,Flood,,Indonesia,IDN,South-Eastern Asia,Dki Jakarta province,2013,1,17,2013,1,31,34,
2013-0034-IDN,2013,Natural,Hydrological,Flood,,Indonesia,IDN,South-Eastern Asia,"Manggala, Biringkanaya, Panakkukang, Tamalanrea areas (Kota Makassar district, Sulawesi Selatan province), Pangkajene Kepulauan, Maros, Jeneponto, Barru, Gowa districts (Sulawesi Selatan province)",2013,1,3,2013,1,10,8,
2013-0126-IDN,2013,Natural,Hydrological,Flood,,Indonesia,IDN,South-Eastern Asia,"Blora district (Jawa Tengah province), Bojonegoro, Ngawi, Tuban, Lamongan, Gresik districts (Jawa Timur province)",2013,4,7,2013,4,11,11,
2013-0364-IDN,2013,Natural,Hydrological,Flood,,Indonesia,IDN,South-Eastern Asia,"Penejam Paser Utara district (Kalimantan Timur province), Sekadau district (Kalimantan Barat province), Bonebolango district (Gorontalo province), Naganraya district (Nangroe Aceh Darussalam province)",2013,9,12,2013,9,12,,
2013-0428-IDN,2013,Natural,Hydrological,Flood,,Indonesia,IDN,South-Eastern Asia,"Stabat, Batang Serangan, Secanggang, Wampu, Padang Tualang villages (Langkat district, Sumatera Utara province)",2013,10,7,2013,10,14,,
2013-0541-IDN,2013,Natural,Hydrological,Flood,,Indonesia,IDN,South-Eastern Asia,Kota Tebingtinggi district (Sumatera Utara province),2013,12,28,2013,12,30,,
2013-0022-IDN,2013,Natural,Hydrological,Landslide,,Indonesia,IDN,South-Eastern Asia,"Agam district (Sumatera Barat province), Kerinci district (Jambi province)",2013,1,25,2013,1,27,21,3
2013-0086-IDN,2013,Natural,Hydrological,Landslide,,Indonesia,IDN,South-Eastern Asia,"Cililin village (Bandung district, Jawa Barat province)",2013,3,25,2013,3,25,13,
2013-0455-IDN,2013,Technological,Technological,Transport accident,,Indonesia,IDN,South-Eastern Asia,Near Java Isl.,2013,7,23,2013,7,23,11,
2013-0475-IDN,2013,Technological,Technological,Transport accident,,Indonesia,IDN,South-Eastern Asia,Java Isl.,2013,9,30,2013,9,30,36,
2013-0128-IDN,2013,Technological,Technological,Industrial accident,Gold mine,Indonesia,IDN,South-Eastern Asia,Gasberg mine (Papua province),2013,5,14,2013,5,14,28,
2013-0250-IDN,2013,Technological,Technological,Miscellaneous accident,Stampede,Indonesia,IDN,South-Eastern Asia,Nabire (Papua),2013,7,14,2013,7,14,17,38
2011-0385-MEX,2011,Natural,Meteorological,Storm,Hurricane Jova,Mexico,MEX,Central America,"Puerto Vallarta district (Jalisco province), Manzanillo district (Colima province), Michoacan, Nayarit provinces",2011,10,10,2011,11,1,5,
2011-0519-PHL,2011,Natural,Meteorological,Storm,Tropical storm Washi (Sendong),Philippines (the),PHL,South-Eastern Asia,"Cagayan district (Region II (Cagayan Valley) province), Negros Oriental, Cebu districts (Region VII (Central Visayas) province), Zamboanga del Norte district (Region IX (Zamboanga Peninsula) province), Misamis Oriental, Lanao del Norte, Bukidnon districts (Region X (Northern Mindanao) province), Compostela district (Region XI (Davao Region) province), Surigao del Sur district (Region XIII (Caraga) province), Lanao del Sur district (Autonomous region in Muslim Mindanao (ARMM) province)",2011,12,15,2011,12,18,1439,6071
2011-0592-PHL,2011,Natural,Hydrological,Flood,,Philippines (the),PHL,South-Eastern Asia,Compostela district (Region XI province),2011,3,31,2011,3,31,2,
2011-0468-PHL,2011,Natural,Hydrological,Flood,,Philippines (the),PHL,South-Eastern Asia,"Cagayan, Isabela districts (Region II province), Aurora district (Region III province), Capiz, Aklan districts (Region VI province)",2011,11,14,2011,11,17,5,13
2011-0378-PHL,2011,Natural,Meteorological,Storm,Typhoon Quiel (Nalgae),Philippines (the),PHL,South-Eastern Asia,"Cordillera Administrative region (CAR), Region I (Ilocos region), Region II (Cagayan Valley), Region III (Central Luzon) provinces",2011,10,1,2011,10,1,25,12
2011-0555-PHL,2011,Natural,Meteorological,Storm,Typhoon Chedeng (Songda),Philippines (the),PHL,South-Eastern Asia,"Taguig city (Metropolitan Manila district, National Capital region (NCR) province), Isabela district (Region II (Cagayan Valley) province), Albay, Camarines Norte, Camarines Sur, Catanduanes, Sorsogon districts (Region V (Bicol region) province), Zamboanga del Sur district (Region IX (Zamboanga Peninsula) province), Bukidnon district (Region X (Northern Mindanao) province), Compostela, Davao del Norte districts (Region XI (Davao Region) province), Lanao del Sur, Maguindanao districts (Autonomous region in Muslim Mindanao (ARMM) province)",2011,5,20,2011,5,29,,
2011-0460-MEX,2011,Natural,Meteorological,Storm,Hurricane Nate,Mexico,MEX,Central America,Tabasco province,2011,9,9,2011,9,9,10,
2011-0512-MEX,2011,Natural,Geophysical,Earthquake,,Mexico,MEX,Central America,Guerrero province,2011,12,11,2011,12,11,2,2
2011-0392-MEX,2011,Natural,Hydrological,Flood,,Mexico,MEX,Central America,Tabasco province,2011,10,20,2011,10,20,,
2011-0589-MEX,2011,Natural,Hydrological,Flood,,Mexico,MEX,Central America,"Choapam, Jamiltepec, Juchitan, Juquila, Pochutla, Tuxtepec, Juchitan districts (Oaxaca province)",2011,7,18,2011,7,18,3,
2011-0633-MEX,2011,Natural,Hydrological,Flood,,Mexico,MEX,Central America,Cuantitlan district (Jalisco province),2011,8,23,2011,9,7,74,
2011-9363-MEX,2011,Natural,Climatological,Drought,,Mexico,MEX,Central America,"Nuevo Leon, Guanajuato, Sonora, Chihuahua, Coahuila, Durango, Zacatecas, San Luis Potosi provinces",2011,9,,2011,12,,,
2011-0445-PHL,2011,Natural,Geophysical,Earthquake,,Philippines (the),PHL,South-Eastern Asia,"Valencia area (Bukidnon district, Region X (Northern Mindanao) province)",2011,11,7,2011,11,7,,3
2011-0564-PHL,2011,Natural,Geophysical,Volcanic activity,Mt. Taal,Philippines (the),PHL,South-Eastern Asia,"Talisay, San Nicolas, Balete areas (Batangas district, Region IV-A (Calabarzon) province)",2011,3,17,2011,4,18,,
2011-0367-PHL,2011,Natural,Hydrological,Flood,,Philippines (the),PHL,South-Eastern Asia,"Landan, Upper Klinan, Klinan 6, Maligo Barangays villages (Polomolok area, South Cotabato district, Region XII province)",2011,9,19,2011,9,19,,
2011-0380-PHL,2011,Natural,Hydrological,Flood,,Philippines (the),PHL,South-Eastern Asia,"Bobuntogan village (Jasaan area, Misamis Oriental district, Region X province)",2011,10,7,2011,10,7,,
2011-0469-PHL,2011,Natural,Hydrological,Flood,,Philippines (the),PHL,South-Eastern Asia,"Carmen, Braulio E. Dujali areas (Davao del Norte district, Region XI province)",2011,11,9,2011,11,14,,
2011-0562-PHL,2011,Natural,Hydrological,Flood,,Philippines (the),PHL,South-Eastern Asia,"Enrique B. Magalona, Victorias City areas (Negros Occidental district (Region VI province)",2011,5,5,2011,5,5,,
2011-0588-PHL,2011,Natural,Hydrological,Flood,,Philippines (the),PHL,South-Eastern Asia,"Zamboanga city (Zamboanga Del Sur district, Region IX province)",2011,7,20,2011,7,20,,
2011-0301-PHL,2011,Natural,Hydrological,Flood,,Philippines (the),PHL,South-Eastern Asia,"Buntalala, Calubihan, Desamparados, Lanit boroughs (Jaro area, Iloilo City area, Iloilo district, Region VI province), Calajunan borough (Manduriao area, Iloilo City area, Iloilo district, Region VI province), Sooc borough (Arevalo area, Iloilo City area, Iloilo district, Region VI province)",2011,8,5,2011,8,5,,
2011-0540-PHL,2011,Natural,Hydrological,Flood,,Philippines (the),PHL,South-Eastern Asia,"Catanduanes district (Region V (Bicol) province), Aklan, Capiz, Negros Occidental districts (Region VI (Western Visayas) province), Cebu district (Region VII (Central Visayas) province), Leyte, Southern Leyte districts (Region VIII (Eastern Visayas) province), Bukidnon district (Region X (Northern Mindanao) province), Compostela, Davao del Norte district (Region XI (Davao Region) province), Agusan del Sur, Dinagat, Surigao del Norte, Surigao del Sur districts (Region XIII (Caraga) province)",2011,12,25,2011,12,28,12,9
2011-0542-PHL,2011,Natural,Hydrological,Flood,,Philippines (the),PHL,South-Eastern Asia,"Casiguran, Dilasag areas (Aurora district, Region III), Isabela, Cagayan districts (Region II province)",2011,12,21,2011,12,21,10,
2011-0305-PHL,2011,Natural,Hydrological,Landslide,,Philippines (the),PHL,South-Eastern Asia,"Asinan village (Zambales district, Region III (Central Luzon) province)",2011,8,5,2011,8,5,,
2011-0341-PHL,2011,Natural,Meteorological,Storm,Typhoon Mina (Nanmadol),Philippines (the),PHL,South-Eastern Asia,"Quezon City area (Metropolitan Manila district, National Capital region (NCR) province), Zambales, Bulacan districts (Region III (Central Luzon) province), Iloilo district (Region IV (Southern Tagalog) province), Benguet, Abra, Mountain Province districts (Cordillera Administrative region (CAR) province), Catanduanes district (Region V (Bicol region) province), Zamboanga Del Sur district (Region IX (Zamboanga Peninsula) province), Region I (Ilocos region) province",2011,8,27,2011,8,29,43,37
2011-0379-PHL,2011,Natural,Meteorological,Storm,Typhoon Pedring (Nesat),Philippines (the),PHL,South-Eastern Asia,"Mindoro Occidental, Mindoro Oriental, Romblon districts (Region IV (Southern Tagalog) province), Albay, Camarines Norte, Camarines Sur, Catanduanes districts (Region V (Bicol region) province), Antique, Iloilo districts (Region VI (Western Visayas) province), Cordillera Administrative region (CAR), National Capital region (NCR), Region I (Ilocos region), Region II (Cagayan Valley), Region III (Central Luzon), Region IV-A (Calabarzon) province",2011,9,24,2011,9,24,103,91
2011-0384-PHL,2011,Natural,Meteorological,Storm,Tropical Storm Ramon (Banyan),Philippines (the),PHL,South-Eastern Asia,"Mindoro Oriental, Romblon districts (Region IV (Southern Tagalog) province), Capiz, Iloilo, Negros Occidental districts (Region VI (Western Visayas) province), Cebu district (Region VII (Central Visayas) province), Southern Leyte district (Region VIII (Eastern Visayas) province), Misamis Oriental district (Region X (Northern Mindanao) province), South Cotabato district (Region XII (Soccsksargen) province), Dinagat district (Region XIII (Caraga) province)",2011,10,13,2011,10,13,11,6
2011-0576-PHL,2011,Natural,Meteorological,Storm,Tropical Storm Haima (Egay),Philippines (the),PHL,South-Eastern Asia,"Autonomous region in Muslim Mindanao (ARMM), Cordillera Administrative region (CAR), National Capital region (NCR), Region I (Ilocos region), Region II (Cagayan Valley), Region III (Central Luzon), Region IV (Southern Tagalog) Region IV-A (Calabarzon), Region IX (Zamboanga Peninsula), Region V (Bicol region), Region VI (Western Visayas), Region VII (Central Visayas), Region VIII (Eastern Visayas), Region X (Northern Mindanao), Region XI (Davao Region), Region XII (Soccsksargen), Region XIII (Caraga) provinces",2011,6,14,2011,6,20,,
2011-0393-PHL,2011,Natural,Biological,Epidemic,Diarrhoea,Philippines (the),PHL,South-Eastern Asia,"Tinoto, Massim (Sarangani province)",2011,10,11,2011,10,18,3,200
2011-0563-PHL,2011,Natural,Biological,Epidemic,Cholera,Philippines (the),PHL,South-Eastern Asia,Palawan,2011,3,1,2011,4,18,20,
2011-0545-PHL,2011,Natural,Biological,Epidemic,Dengue,Philippines (the),PHL,South-Eastern Asia,"Cavite, Laguna, Batangas, Rizal, Quezon provinces",2011,1,1,2011,8,,33,
2011-0502-PHL,2011,Technological,Technological,Transport accident,,Philippines (the),PHL,South-Eastern Asia,Manilla,2011,12,10,2011,12,10,18,20
2011-0565-PHL,2011,Technological,Technological,Transport accident,Cargo,Philippines (the),PHL,South-Eastern Asia,Luzon Isl.,2011,12,25,2011,12,25,22,
2011-0333-TCD,2011,Natural,Biological,Epidemic,Cholera,Chad,TCD,Middle Africa,"Flanga, Gounougaya, Bongor, Guelendeng, N'Djam Est, N'Djam Centre, N'Djam Sud, Massaquete, Massakory, Bokoro, Lai, Kelo, Bere, Dourbali, Mandalia, Bousso, Massenya, Lere, Paia, Mao, Amtiman, Aboudia, BOL, Ngouri, Moussoro, Mongo, Bitkine, Mangaime, Benoye, Abeche, Melfi, Yao, Oumhadjer districts",2011,8,9,2011,10,14,433,
2012-0060-USA,2012,Natural,Meteorological,Storm,,United States of America (the),USA,Northern America,"Alabama, Tennessee, Illinois, Kentucky, Indiana, Ohio, Georgia, Florida, Mississippi, North Carolina, Virginia provinces",2012,3,2,2012,3,4,41,
2012-0406-PHL,2012,Natural,Meteorological,Storm,Typhoon Son Tinh (Ofel),Philippines (the),PHL,South-Eastern Asia,"National Capital region (NCR), Region I (Ilocos region), Region III (Central Luzon), Region IV (Southern Tagalog), Region IV-A (Calabarzon), Region V (Bicol region), Region VI (Western Visayas), Region VII (Central Visayas), Region VIII (Eastern Visayas), Region XIII (Caraga) province",2012,10,25,2012,10,25,36,19
2012-0540-PHL,2012,Natural,Meteorological,Storm,Tropical storm Wukong (Quinta),Philippines (the),PHL,South-Eastern Asia,"Region IV (Southern Tagalog), Region V (Bicol region), Region VI (Western Visayas), Region VII (Central Visayas), Region VIII (Eastern Visayas) provinces",2012,12,25,2012,12,27,24,3
2012-0031-PHL,2012,Natural,Geophysical,Earthquake,,Philippines (the),PHL,South-Eastern Asia,"Tayasan area (Negros Oriental district, Region VII (Central Visayas) province)",2012,2,6,2012,2,6,113,112
2012-0260-PHL,2012,Natural,Meteorological,Storm,Tropical storm Gener (Saola),Philippines (the),PHL,South-Eastern Asia,"Ilocos Sur, Pangasinan districts (Region I (Ilocos region) province), Cagayan district (Region II (Cagayan Valley) province), Bataan, Bulacan, Nueva Ecija, Pampanga, Tarlac districts (Region III (Central Luzon) province), Batangas, Cavite, Laguna, Rizal district (Region IV-A (Calabarzon) province), Mindoro Occidental district (Region IV (Southern Tagalog) province), Aklan, Antique, Iloilo, Negros Occidental districts (Region VI (Western Visayas) province), Cebu district (Region VII (Central Visayas) province), Lanao del Norte, Misamis Oriental districts (Region X (Northern Mindanao) province), North Cotabato, South Cotabato districts (Region XII (Soccsksargen) province), Benguet, Ifugao, Kalinga, Mountain Province districts (Cordillera Administrative region (CAR) province), National Capital region (NCR) province",2012,7,31,2012,8,7,58,35
2012-0296-PHL,2012,Natural,Meteorological,Storm,Typhoon Igme (Tembin),Philippines (the),PHL,South-Eastern Asia,La Union district (Region I (Ilocos region) province),2012,8,20,2012,8,21,11,1
2012-0374-PHL,2012,Natural,Meteorological,Storm,Typhoon Lawin (Jelawat),Philippines (the),PHL,South-Eastern Asia,"Muntinlupa city (Metropolitan Manila district, National Capital region (NCR) province), Zamboanga del Norte district (Region IX (Zamboanga Peninsula) province)",2012,9,21,2012,9,24,4,
2012-0124-MEX,2012,Natural,Geophysical,Earthquake,,Mexico,MEX,Central America,"Guerrero, Oaxaca, Mexico provinces",2012,3,20,2012,3,20,2,11
2012-0276-MEX,2012,Natural,Meteorological,Storm,Ernesto,Mexico,MEX,Central America,"Tabasco, Veracruz, Guerrero, Quintana Roo, Puebla, Oaxaca provinces",2012,8,10,2012,8,10,12,
2012-0401-MEX,2012,Natural,Meteorological,Storm,Hurricane Carlotta,Mexico,MEX,Central America,"Puerto Escondido city (Dist. Pochutla district, Oaxaca province)",2012,6,15,2012,6,15,7,
2012-0099-MEX,2012,Technological,Technological,Transport accident,,Mexico,MEX,Central America,Veracruz state,2012,4,20,2012,4,20,43,20
2012-0229-MEX,2012,Technological,Technological,Transport accident,,Mexico,MEX,Central America,Guerrero state,2012,6,24,2012,6,24,28,22
2012-0381-MEX,2012,Technological,Technological,Industrial accident,Gaz factory,Mexico,MEX,Central America,Near Reynosa,2012,9,19,2012,9,19,32,26
2012-0321-PHL,2012,Natural,Geophysical,Earthquake,,Philippines (the),PHL,South-Eastern Asia,"Valencia, Maramag areas (Bukidnon district, Region X (Northern Mindanao) province)",2012,9,4,2012,9,4,,1
2012-0431-PHL,2012,Natural,Geophysical,Earthquake,,Philippines (the),PHL,South-Eastern Asia,"Guian town (Eastern Samar district, Region VIII (Eastern Visayas) province)",2012,8,31,2012,8,31,1,10
2012-0171-PHL,2012,Natural,Hydrological,Flood,,Philippines (the),PHL,South-Eastern Asia,"Kalamansig area (Sultan Kudarat district, Region XII province)",2012,6,11,2012,6,11,,
2012-0172-PHL,2012,Natural,Hydrological,Flood,,Philippines (the),PHL,South-Eastern Asia,"Glen area (Saranggani district, Region XII province), Maguindanao district (ARMM province), North Cotabato, Sultan Kudarat districts (Region XII province)",2012,6,9,2012,6,12,1,
2012-0009-PHL,2012,Natural,Hydrological,Flood,,Philippines (the),PHL,South-Eastern Asia,"Agusan del Sur, Surigao del Sur districts (Region XIII province), Leyte district (Region VIII province), Compostela, Davao del Norte districts (Region XI province), Negros Occidental district (Region VI province), Region IV province",2012,1,17,2012,1,17,4,
2012-0042-PHL,2012,Natural,Hydrological,Flood,,Philippines (the),PHL,South-Eastern Asia,"Jabonga area (Agusan del Norte district, Region XIII province), Kauswagan and Bacolod areas (Lanao del Norte district, Region X province)",2012,2,14,2012,2,16,,
2012-0078-PHL,2012,Natural,Hydrological,Flood,,Philippines (the),PHL,South-Eastern Asia,"Lambayong area (Sultan Kudarat district, Region XII province), Agusan del Norte, Surigao del Norte districts (Region XIII province)",2012,2,20,2012,2,27,,
2012-0272-PHL,2012,Natural,Hydrological,Flood,,Philippines (the),PHL,South-Eastern Asia,"Metropolitan Manila district (National Capital region (NCR) province), Ilocos Sur, La Union, Pangasinan districts (Region I (Ilocos Region) province), Bataan, Bulacan, Nueva Ecija, Pampanga, Tarlac, Zambales districts (Region III (Central Luzon) province), Batangas, Cavite, Laguna, Rizal districts (Region IV-A (Calabarzon) province), Mindoro Occidental, Mindoro Oriental districts (Region IV (Southern Tagalog) province), Iloilo district (Region VI (Western Visayas) province)",2012,8,6,2012,8,8,112,14
2012-0396-PHL,2012,Natural,Hydrological,Flood,,Philippines (the),PHL,South-Eastern Asia,Region VI (Western Visayas) province,2012,3,27,2012,3,27,11,
2012-0602-PHL,2012,Natural,Hydrological,Flood,,Philippines (the),PHL,South-Eastern Asia,"Region XIII (Caraga), Autonomous region in Muslim Mindanao (ARMM), Region IX (Zamboanga Peninsula), Region X (Northern Mindanao), Region XI (Davao Region), Region XII (Soccsksargen) provinces",2012,6,12,2012,6,13,29,2
2012-0002-PHL,2012,Natural,Hydrological,Landslide,,Philippines (the),PHL,South-Eastern Asia,"Napnapan village (Compostela district, Region XI (Davao Region) province)",2012,1,5,2012,1,5,75,16
2012-0294-PHL,2012,Natural,Meteorological,Storm,TYphoon Kai-Tak,Philippines (the),PHL,South-Eastern Asia,"Cordillera Administrative region (CAR), National Capital region (NCR), Region I (Ilocos region), Region II (Cagayan Valley), Region III (Central Luzon), Region IV-A (Calabarzon) provinces",2012,8,17,2012,8,17,4,
2012-0434-PHL,2012,Natural,Meteorological,Storm,Typhoon Karen,Philippines (the),PHL,South-Eastern Asia,"National Capital region (NCR), Region III (Central Luzon) provinces",2012,9,13,2012,9,14,1,
2012-0463-PHL,2012,Natural,Meteorological,Storm,Tropical Storm Marce (Gaemi),Philippines (the),PHL,South-Eastern Asia,"Zambales district (Region III (Central Luzon) province), Mindoro Occidental district (Region IV (Southern Tagalog) province)",2012,10,3,2012,10,3,,
2012-0500-PHL,2012,Natural,Meteorological,Storm,Typhoon Bopha,Philippines (the),PHL,South-Eastern Asia,Region XI (Davao Region) province,2012,12,4,2012,12,4,1901,2666
2012-0201-PHL,2012,Natural,Biological,Epidemic,Cholera,Philippines (the),PHL,South-Eastern Asia,"Catanduanes, Camarines Sur, Sorsogon, Albay, Camarines Norte, Masbate provinces (Bicol)",2012,1,,2012,7,,30,
2012-0170-PHL,2012,Technological,Technological,Transport accident,Ferry 'MV Josille',Philippines (the),PHL,South-Eastern Asia,North Palawan Isl.,2012,6,13,2012,6,13,24,
2012-0239-PHL,2012,Technological,Technological,Miscellaneous accident,Shop,Philippines (the),PHL,South-Eastern Asia,Butuan,2012,5,9,2012,5,9,18,3
2012-0347-TCD,2012,Natural,Hydrological,Flood,,Chad,TCD,Middle Africa,"Rig-rig, Sultanat, Ntiona, Nokou districts (Kanem province), Dadjo-ii, Moubi-goz, Moubi-Hadaba, Moubi-zarga districts (Guera province), Ndjamena, Madiago, Katoa, Kadada, El-fass, Afrouk districts (Hadjer Lamis province), Assongha, Baguirmi, Tandjile Est, Tandjile Ouest, Sila, Barh Koh, Mayo-Boneye, Mayo-Dala, Logone Occidental, Logone Oriental, Kabia, Ouaddai, Batha Ouest, Batha Est, Lac Iro, Mandoul, Mont De Lam, Salamat provinces",2012,7,15,2012,9,24,20,
2012-0384-TCD,2012,Natural,Hydrological,Flood,,Chad,TCD,Middle Africa,"Walia, Ngoumna, Ngueli boroughs (Ndjamena district, Hadjer Lamis province), Yaroungou, Moula refugees camps (Maro district, Barh Koh province)",2012,9,15,2012,10,15,,
2012-0108-TCD,2012,Natural,Biological,Epidemic,Meningitis,Chad,TCD,Middle Africa,"Oumhadjer, Massakory, Lere, Amdam, Aboudea, Amtiman, Donamanga, Bebeto, Koumra, Moissala districts",2012,1,,2012,3,25,88,
2012-0234-USA,2012,Natural,Meteorological,Storm,,United States of America (the),USA,Northern America,District of Columbia province,2012,6,30,2012,6,30,1,
2012-0612-USA,2012,Natural,Meteorological,Storm,,United States of America (the),USA,Northern America,"Oklahoma, Kansas, Minnesota, Texas, Pennsylvania, New York provinces",2012,5,25,2012,5,30,,
2012-0613-USA,2012,Natural,Meteorological,Storm,,United States of America (the),USA,Northern America,"Colorado, Wyoming provinces",2012,6,6,2012,6,7,,2
