Dis No,Year,Disaster Group,Disaster Subgroup,Disaster Type,Event Name,Country,ISO,Region,Location,Start Year,Start Month,Start Day,End Year,End Month,End Day,Total Deaths,No Injured
2008-0292-PHL,2008,Natural,Meteorological,Storm,"Tropical Storm ""Fung-Wong"" (Igme)",Philippines (the),PHL,South-Eastern Asia,"Piddig, Pasuquin areas (Metropolitan Manila district, National Capital region (NCR) province), Ilocos Norte, Ilocos Sur districts (Region I (Ilocos region) province), Abra district (Cordillera Administrative region (CAR) province)",2008,7,28,2008,7,29,10,2
2008-0329-PHL,2008,Natural,Meteorological,Storm,"Tropical storm ""Kammuri"" (Julian)",Philippines (the),PHL,South-Eastern Asia,"Quezon city (Metropolitan Manila district, National Capital region (NCR) province), Cordillera Administrative region (CAR), Region I (Ilocos region), Region III (Central Luzon) provinces",2008,8,4,2008,8,4,2,
2008-0540-PHL,2008,Natural,Meteorological,Storm,"Tropical Storm ""Maysak"" (Quinta-Sony)",Philippines (the),PHL,South-Eastern Asia,"Region IV (Southern Tagalog), Region V (Bicol region), Region VI (Western Visayas), Region VII (Central Visayas), Region VIII (Eastern Visayas) provinces",2008,11,6,2008,11,11,19,14
2008-0609-PHL,2008,Natural,Meteorological,Storm,"TYphoon ""Rammasun"" (Butchoy)",Philippines (the),PHL,South-Eastern Asia,"Lambayong, Esperanza areas (Sultan Kudarat district, Region XII (Soccsksargen) province)",2008,5,13,2008,5,13,1,40
2008-0621-PHL,2008,Natural,Meteorological,Storm,"Typhoon ""Helen""",Philippines (the),PHL,South-Eastern Asia,"Nueva Era, Paoay, San Nicolas, Bangui, Batac city, Dingras, Pasuquin, Marcos, Piddig, Laoag city, Bacarra, Sarrat, Currimao, Pagudpud areas (Ilocos Norte district, Region I (Ilocos region) province), Luna area (La Union district, Region I (Ilocos region) province), Santa Terisita area (Cagayan district, Region II (Cagayan Valley) province)",2008,7,18,2008,7,18,2,1
2008-0338-USA,2008,Natural,Meteorological,Storm,"Tropical Storm ""Fay""",United States of America (the),USA,Northern America,"Florida, Georgia, Alabama, Mississippi provinces",2008,8,20,2008,8,28,12,
2008-0384-USA,2008,Natural,Meteorological,Storm,Hurricane Ike,United States of America (the),USA,Northern America,"Galveston, Brazoria, Harris, Chambers, Jefferson districts (Texas province), Louisiana, Tennessee, Arkansas, Ohio, Indiana, Illinois, Missouri, Kentucky, Pennsylvania, Michigan provinces",2008,9,12,2008,9,16,82,
2008-0288-MEX,2008,Natural,Hydrological,Flood,,Mexico,MEX,Central America,"Hidalgo, Tamaulipas, Zacatecas, Tabasco, Veracruz, Oaxaca provinces",2008,7,6,2008,7,11,12,
2008-0433-MEX,2008,Natural,Hydrological,Landslide,,Mexico,MEX,Central America,"Huautla de Jimenez municipality (Teotitlan district, Oaxaca state)",2008,9,17,2008,9,18,22,
2008-0158-MEX,2008,Technological,Technological,Transport accident,Helicopter Bell-212,Mexico,MEX,Central America,Uruapan (Michoacan state),2008,4,18,2008,4,18,11,
2008-0531-MEX,2008,Technological,Technological,Transport accident,Bi-motor,Mexico,MEX,Central America,Near Mexico,2008,11,4,2008,11,4,15,7
2008-0198-MEX,2008,Technological,Technological,Transport accident,,Mexico,MEX,Central America,Sierra d'Hidalgo,2008,5,19,2008,5,19,24,
2008-0255-MEX,2008,Technological,Technological,Transport accident,,Mexico,MEX,Central America,Chihuahua state,2008,6,29,2008,6,29,14,28
2008-0287-MEX,2008,Technological,Technological,Transport accident,,Mexico,MEX,Central America,Tantoyucan road (Veracruz state),2008,7,7,2008,7,7,11,
2008-0494-MEX,2008,Technological,Technological,Transport accident,,Mexico,MEX,Central America,Near Calpulapan (Mexico state),2008,10,18,2008,10,18,11,20
2008-0512-MEX,2008,Technological,Technological,Transport accident,,Mexico,MEX,Central America,Oaxaca,2008,11,7,2008,11,7,17,5
2008-0248-MEX,2008,Technological,Technological,Miscellaneous accident,,Mexico,MEX,Central America,Mexico city,2008,6,20,2008,6,20,12,20
2008-0347-PHL,2008,Natural,Hydrological,Flood,,Philippines (the),PHL,South-Eastern Asia,"Bansalan area (Davao del Sur district, Region XI province)",2008,6,6,2008,6,6,1,
2008-0545-PHL,2008,Natural,Hydrological,Flood,,Philippines (the),PHL,South-Eastern Asia,"Alcala, Amulung, Enrile, Gattaran, Iguig, Lasam, Claveria, Peablanca, Solana, Tuguegarao city, Tuao, Camalaniugan, Lallo, Baggao areas (Cagayan district, Region II province), Cauayan city, Quezon, Cabagan, Delfin Albano, Ilagan, Mallig, Tumauni, San Pablo, Sta. Maria, Sto. Thomas areas (Isabela district, Region II province), Casiguran, Dinalungan, Dilasag areas (Aurora district, Region III province), Rizal, Lubuagan areas (Kalinga district, CAR province)",2008,11,21,2008,11,24,10,
2008-0571-PHL,2008,Natural,Hydrological,Flood,,Philippines (the),PHL,South-Eastern Asia,"Region II (Cagayan Valley), Region V (Bicol region), Region XIII (Caraga), Region XI (Davao Region), Region III (Central Luzon), Region IV-A (Calabarzon), Region IV (Southern Tagalog) provinces",2008,12,1,2008,12,4,29,
2008-0608-PHL,2008,Natural,Hydrological,Flood,,Philippines (the),PHL,South-Eastern Asia,"Nueva Ecija, Tarlac, Pampanga, Bulacan districts (Region III province)",2008,8,8,2008,8,8,,
2008-0611-PHL,2008,Natural,Hydrological,Flood,,Philippines (the),PHL,South-Eastern Asia,"Asucion area (Davao del Norte district, Region XI province), Initao, Gitagum areas (Misamis Oriental district, Region X province)",2008,1,18,2008,1,18,,
2008-0620-PHL,2008,Natural,Hydrological,Flood,,Philippines (the),PHL,South-Eastern Asia,"Manay area (Davao Oriental district, Region XI province), Braulio E. Dujali area (Davao del Norte district, Region XI province)",2008,6,17,2008,6,17,7,1
2008-0622-PHL,2008,Natural,Hydrological,Flood,,Philippines (the),PHL,South-Eastern Asia,"Pigcawayan, Midsayap, Pikit areas (North Cotabato district, Region XII province), Sultan Kudarat, Mother Kabuntalan, Northern Kabuntalan, Datu Odin Sinsuat areas (Shariff Kabunsuan district, ARMM province), Sultan Sabarongis, Rajah Buauan, Mamasapano, Datu Piang, Datu Anggal Midtimbang, Datu Saudi Ampatuan areas (Maguindanao district, ARMM province)",2008,9,4,2008,9,13,6,3
2008-0393-PHL,2008,Natural,Hydrological,Landslide,,Philippines (the),PHL,South-Eastern Asia,"Maco city (Compostela district, Region XI (Davao Region) province)",2008,9,6,2008,9,6,24,28
2008-0155-PHL,2008,Natural,Meteorological,Storm,"Typhoon ""Neoguri"" (Ambo)",Philippines (the),PHL,South-Eastern Asia,"Autonomous region in Muslim Mindanao (ARMM), Region IX (Zamboanga Peninsula), Region X (Northern Mindanao), Region XI (Davao Region), Region XII (Soccsksargen), Region XIII (Caraga) provinces",2008,4,13,2008,4,13,1,
2008-0369-PHL,2008,Natural,Meteorological,Storm,"Tropical storm ""Nuri"" (Karen)",Philippines (the),PHL,South-Eastern Asia,"Region I (Ilocos region), Region II (Cagayan Valley), Cordillera Administrative region (CAR) provinces",2008,8,22,2008,8,22,38,13
2008-0623-PHL,2008,Natural,Meteorological,Storm,"TRopical storm ""Higos"" (Pablo)",Philippines (the),PHL,South-Eastern Asia,"Nueva Ecija, Pampanga districts (Region III (Central Luzon) province)",2008,9,29,2008,9,29,1,
2008-0250-PHL,2008,Technological,Technological,Transport accident,Ferry MV Princess of the Stars,Philippines (the),PHL,South-Eastern Asia,"Claveria (Near Sibuyan Island, Romblon)",2008,6,21,2008,6,21,815,
2008-0505-PHL,2008,Technological,Technological,Transport accident,"Ferry ""Don Dexter Kathleen""",Philippines (the),PHL,South-Eastern Asia,Near Masbate Island,2008,11,4,2008,11,4,42,
2008-0566-PHL,2008,Technological,Technological,Transport accident,"Ferry ""Maejan""",Philippines (the),PHL,South-Eastern Asia,Near Ballesteros,2008,12,15,2008,12,15,56,
2008-0610-PHL,2008,Technological,Technological,Miscellaneous accident,Slum,Philippines (the),PHL,South-Eastern Asia,Malabon city,2008,5,7,2008,5,7,1,3
2008-0367-TCD,2008,Natural,Hydrological,Flood,,Chad,TCD,Middle Africa,"Ndjamena district (Hadjer Lamis province), Barh Koh, Lac Iro provinces",2008,7,20,2008,8,25,,
2008-0445-TCD,2008,Natural,Hydrological,Flood,,Chad,TCD,Middle Africa,"Kerfi village (Goz-beida district, Sila province)",2008,9,15,2008,9,15,,
2008-0448-TCD,2008,Natural,Biological,Epidemic,Hepatite E,Chad,TCD,Middle Africa,"Dogdore, Bredjing camps",2008,1,1,2008,10,1,22,
2008-0291-TGO,2008,Natural,Hydrological,Flood,,Togo,TGO,Western Africa,"Agou, Ogou, Kloto, Haho districts (Plateaux province), Ave, Golfe, Vo, Zio districts (Maritime province)",2008,7,1,2008,8,8,6,79
2008-0599-USA,2008,Natural,Meteorological,Storm,,United States of America (the),USA,Northern America,"Arkansas, Illinois, Indiana, Kentucky, Missouri, New York, Ohio, Tennessee, Alabama, Mississippi provinces",2008,1,29,2008,1,30,4,
2008-0601-USA,2008,Natural,Meteorological,Storm,,United States of America (the),USA,Northern America,"Arkansas, Oklahoma, Texas provinces",2008,4,9,2008,4,11,3,
2008-0645-USA,2008,Natural,Meteorological,Storm,,United States of America (the),USA,Northern America,Suffolk district (Virginia province),2008,4,28,2008,4,28,,200
2008-0654-USA,2008,Natural,Meteorological,Storm,,United States of America (the),USA,Northern America,"Massachusetts, New York, Maine, New Hampshire, Vermont provinces",2008,12,11,2008,12,22,5,
2008-0563-USA,2008,Natural,Meteorological,Extreme temperature,,United States of America (the),USA,Northern America,"Maine, Massachusetts, New Hampshire, New York, Vermont provinces",2008,12,11,2008,12,14,,
2008-0099-USA,2008,Natural,Geophysical,Earthquake,,United States of America (the),USA,Northern America,"Wells city (Elko district, Nevada province)",2008,2,21,2008,2,21,,3
2008-0600-USA,2008,Natural,Meteorological,Storm,,United States of America (the),USA,Northern America,"Arkansas, California, Colorado, Illinois, Indiana, Kansas, Michigan, Missouri, New York, Ohio, Oklahoma, Oregon, Washington, Wisconsin provinces",2008,1,4,2008,1,9,12,
2008-0352-USA,2008,Natural,Meteorological,Storm,"Hurricane ""Gustav""",United States of America (the),USA,Northern America,"Louisiana, Mississippi, Texas, Alabama provinces",2008,9,1,2008,9,1,43,
2008-0378-USA,2008,Natural,Meteorological,Storm,Hurricane Hanna,United States of America (the),USA,Northern America,"Florida, North Carolina, Maryland provinces",2008,8,28,2008,8,28,7,
2008-0253-USA,2008,Natural,Climatological,Wildfire,,United States of America (the),USA,Northern America,California province,2008,6,20,2008,7,9,1,
2008-0356-USA,2008,Technological,Technological,Transport accident,Bimoteur,United States of America (the),USA,Northern America,Utah,2008,8,22,2008,8,22,10,
2008-0330-USA,2008,Technological,Technological,Transport accident,,United States of America (the),USA,Northern America,Texas,2008,8,8,2008,8,8,12,26
2008-0474-USA,2008,Technological,Technological,Transport accident,,United States of America (the),USA,Northern America,Near Williams (California),2008,10,5,2008,10,5,10,30
2008-0404-USA,2008,Technological,Technological,Transport accident,,United States of America (the),USA,Northern America,Chatsworth (near Los Angeles),2008,9,13,2008,9,13,25,135
2008-0143-USA,2008,Technological,Technological,Miscellaneous accident,House,United States of America (the),USA,Northern America,Pennsylvania,2008,4,3,2008,4,3,10,
2008-0524-USA,2008,Natural,Climatological,Wildfire,,United States of America (the),USA,Northern America,"Los Angeles, Orange, Riverside, Santa Barbara districts (California province)",2008,11,13,2008,11,18,,20
2009-0165-PHL,2009,Natural,Meteorological,Storm,"Typhoon ""Emong"" (Chanom)",Philippines (the),PHL,South-Eastern Asia,"Aringay, Agoo, Bacnotan, Bagulin, Bauang, Burgos, Caba, Naguillian Pugo, Rosario, San Gabriel, San Juan, Sto Thomas, Tubao, San Fernando areas (La Union district, Region I (Ilocos region) province), Anda, Agno, Bani, Bolinao, Dasol, Infanta, Lingayan, Mabini, Sta Barbara, Sual, Alaminos city, Dagupan areas (Pangasinan district, Region I (Ilocos region) province), Ambaguio, Bagabag, Bambang, Bayombong, Dupax del Sur, Solano, Sta Fe areas (Nueva Vizcaya district, Region II (Cagayan Valley) province), Aurora, Cabaruan, Cordon, Delfin Albano, Ilagan, Luna, Quirino, Ramon, Reina Mercedes, Cauayan city, Santiago areas (Isabela district, Region II (Cagayan Valley) province), Cabarroguis, Saguiday areas (Quirino district, Region II (Cagayan Valley) province), Rizal area (Cagayan district, Region II (Cagayan Valley) province), Sta Cruz, Olongapo areas (Zambales district, Region III (Central Luzon) province), Guagua area (Pampanga district, Region III (Central Luzon) province), Kiangan, Asipulo, Lamut, Lagawe, Hingyon, Hungduan, Tinoc, Aguinaldo, Alfonso Lista areas (Ifugao district, Cordillera Administrative region (CAR) province), Pinukpuk, Lubuagan areas (Kalinga district, Cordillera Administrative region (CAR) province), Baguio city (Benguet district, Cordillera Administrative region (CAR) province)",2009,5,7,2009,5,10,77,53
2009-0140-USA,2009,Natural,Meteorological,Storm,,United States of America (the),USA,Northern America,"Texas, Oklahoma, Arkansas, Alabama, Georgia, Kentucky, Louisiana, Missouri, South Carolina, Tennessee provinces",2009,4,9,2009,4,10,9,72
2009-0023-PHL,2009,Natural,Hydrological,Flood,,Philippines (the),PHL,South-Eastern Asia,"Aringay area (La Union district, Region I province), Brroke's Point, Bataraza, Balabac areas (Palawan district, Region IV province), Labo area (Camarines Norte district, Region V province), Bagamanoc, Baras, Bato, Caramoran, Gigmoto, Pandan, Panganiban, San Andres, San Miguel, Viga, Virac areas (Catanduanes district, Region V province), Pontevedra, Panitan, Sigma, Dao, Cuartero areas (Capiz district, Region VI province), Amlan area (Negros Oriental district, Region VII province), Bobon, Catarman, Lavesares, Lope de Vega, Mondragon, Palapag, San Roque areas (Northern Samar district, Region VIII province), Cayagan de Oro City area (Misamis Oriental district, Region X province), Region XIII (Caraga) province",2009,1,2,2009,1,15,33,15
2009-0113-MEX,2009,Technological,Technological,Transport accident,,Mexico,MEX,Central America,Coahuila state,2009,3,16,2009,3,16,11,18
2009-0151-MEX,2009,Technological,Technological,Transport accident,,Mexico,MEX,Central America,Chiapas state,2009,4,16,2009,4,16,18,66
2009-0115-MEX,2009,Technological,Technological,Industrial accident,Gas intoxication,Mexico,MEX,Central America,Hidalgo province,2009,3,21,2009,3,21,11,1
2009-0027-PHL,2009,Natural,Hydrological,Flood,,Philippines (the),PHL,South-Eastern Asia,"Poblacion, Mago-ong, Samburon baranguays villages (Linamon area, Labao del Norte district, Region X province)",2009,1,8,2009,1,8,,
2009-0026-PHL,2009,Natural,Hydrological,Flood,,Philippines (the),PHL,South-Eastern Asia,"Malibago, Gumamela, Anahaw, Bagacay, Santa Cruz villages (Labo area, Camarines Norte district, Region V province)",2009,1,9,2009,1,9,,
2009-0150-TCD,2009,Natural,Biological,Epidemic,Meningitis,Chad,TCD,Middle Africa,,2009,1,,2009,4,,102,
2009-0098-TGO,2009,Technological,Technological,Transport accident,,Togo,TGO,Western Africa,Togblékopé,2009,3,9,2009,3,10,19,
2009-0106-USA,2009,Natural,Hydrological,Flood,,United States of America (the),USA,Northern America,"North Dakota, Minnesota provinces",2009,3,24,2009,4,20,2,60
2009-0056-USA,2009,Natural,Meteorological,Extreme temperature,,United States of America (the),USA,Northern America,"Texas, Pennsylvania, Oklahoma, Kentucky, Missouri, Arkansas, District of Columbia provinces",2009,1,26,2009,1,28,58,
2009-0071-USA,2009,Technological,Technological,Transport accident,Bombardier Dash 8 Q400,United States of America (the),USA,Northern America,Clarence Center (New york State),2009,2,12,2009,2,12,50,
2009-0111-USA,2009,Technological,Technological,Transport accident,,United States of America (the),USA,Northern America,Butte (Montana),2009,3,22,2009,3,22,14,
2009-0421-IDN,2009,Natural,Geophysical,Earthquake,,Indonesia,IDN,South-Eastern Asia,"Agam, Kepulauan Mentawai, Kota Bukitinggi, Kota Padang, Kota Padangpanjang, Kota Pariaman, Kota Pasaman, Kota Pasaman Barat, Kota Payakumbuh, Kota Sawahlunto, Kota Solok, Limapuluhkoto, Padangpariaman, Solok, Solok Selatan, Pesisir Selatan, Sawahlunto/sijunjung, Tanahdatar districts (Sumatera Barat province), Keranci, Merangin districts (Jambi province)",2009,9,30,2009,9,30,1195,1798
2009-0204-BGD,2009,Natural,Meteorological,Storm,"Cyclone ""Aila""",Bangladesh,BGD,Southern Asia,"Khulna, Satkhira, Jessore, Bagerhat districts (Khulna province), Patuakhali, Bhola, Barisal, Barguna, Pirojpur, Jhalokati districts (Barisal province), Lakshmipur, Chittagong, Noakhali, Cox's Bazar, Feni, Chandpur districts (Chittagong province)",2009,5,25,2009,5,26,190,7103
2009-0294-BGD,2009,Natural,Hydrological,Flood,,Bangladesh,BGD,Southern Asia,Habiganj district (Sylhet province),2009,7,3,2009,7,6,6,
2009-0354-IDN,2009,Natural,Geophysical,Earthquake,,Indonesia,IDN,South-Eastern Asia,"Cianjur, Bandung, Kota Bandung, Garut, Tasikmalaya, Kota Tasilmalaya, Sukabumi, Kota Bogor, Bogor, Ciamis, Sumedang, Kuningan, Kota Banjar, Purwakarta, Kota Cimahi, Kota Sukabumi districts (Jawa Barat province), Cilacap district (Jawa Tengah province), Dki Jakarta province",2009,9,2,2009,9,2,128,1442
2009-0304-BGD,2009,Natural,Hydrological,Flood,,Bangladesh,BGD,Southern Asia,"Comilla, Chittagong districts (Chittagong province), Dhaka, Rajshahi, Barisal, Khulna, Sylhet provinces",2009,7,29,2009,7,29,10,
2009-0472-BGD,2009,Technological,Technological,Transport accident,,Bangladesh,BGD,Southern Asia,Padmar river,2009,10,24,2009,10,24,14,
2009-0524-BGD,2009,Technological,Technological,Transport accident,Ferry,Bangladesh,BGD,Southern Asia,Daira river (Kirshorgank district),2009,12,4,2009,12,4,53,
2009-0525-BGD,2009,Technological,Technological,Transport accident,Ferry MV Koko-4,Bangladesh,BGD,Southern Asia,"Nazirpur, Lalmohon, Bhola",2009,11,27,2009,11,27,91,
2009-0619-CAN,2009,Natural,Meteorological,Storm,,Canada,CAN,Northern America,New Brunswick province,2009,8,1,2009,8,3,2,
2009-0189-CAN,2009,Natural,Hydrological,Flood,,Canada,CAN,Northern America,New Brunswick / Nouveau-Brunswick province,2009,4,1,2009,4,9,,
2009-0342-CAN,2009,Natural,Meteorological,Storm,Hurricane Bill,Canada,CAN,Northern America,"Nova Scotia, Newfoundland and Labrador provinces",2009,8,23,2009,8,23,,3
2009-0308-GIN,2009,Natural,Hydrological,Flood,,Guinea,GIN,Western Africa,"Kindia town (Kindia district, Kindia province), Conakry province,",2009,8,3,2009,8,3,2,
2009-0479-IDN,2009,Natural,Geophysical,Earthquake,,Indonesia,IDN,South-Eastern Asia,"Raba village (Kota Bima district, Nusatenggara Barat province)",2009,11,8,2009,11,8,2,100
2009-0352-IDN,2009,Natural,Hydrological,Flood,,Indonesia,IDN,South-Eastern Asia,"Batang Gadis, Muara villages (Mandailingnatal district, Sumatera Utara province), Tapanuli Selatan district (Sumatera Utara province)",2009,9,15,2009,9,18,38,
2009-0436-IDN,2009,Natural,Hydrological,Flood,,Indonesia,IDN,South-Eastern Asia,Toli-toli district (Sulawesi Tengah province),2009,10,8,2009,10,8,,
2009-0540-IDN,2009,Natural,Hydrological,Flood,,Indonesia,IDN,South-Eastern Asia,"Siau Timur area (Kepulauan-sangihe district, Sulawesi Utara province)",2009,12,8,2009,12,8,6,4
2009-0480-IDN,2009,Natural,Hydrological,Landslide,,Indonesia,IDN,South-Eastern Asia,Kota Palopo district (Sulawesi Selatan province),2009,11,8,2009,11,8,14,
2009-0196-IDN,2009,Technological,Technological,Transport accident,Military plane Air Force Fokker F-27,Indonesia,IDN,South-Eastern Asia,"Geplak (Magetan, Java Isl.)",2009,5,20,2009,5,20,100,15
2009-0520-IDN,2009,Technological,Technological,Transport accident,"Ferry ""Dumai Express 10""",Indonesia,IDN,South-Eastern Asia,Near Karimun Isl.,2009,11,22,2009,11,22,46,
2009-0231-IDN,2009,Technological,Technological,Industrial accident,Coal mine,Indonesia,IDN,South-Eastern Asia,Sawah Lunto (Sumatra Island),2009,6,16,2009,6,16,41,
2009-0208-IDN,2009,Technological,Technological,Miscellaneous accident,Aldulterated alcool,Indonesia,IDN,South-Eastern Asia,Bali Isl.,2009,5,23,2009,5,28,25,
2009-0533-IDN,2009,Technological,Technological,Miscellaneous accident,Karaoke club,Indonesia,IDN,South-Eastern Asia,Medan (North Sumatra),2009,12,4,2009,12,4,20,13
2010-0562-IDN,2010,Natural,Geophysical,Volcanic activity,Mt. Merapi,Indonesia,IDN,South-Eastern Asia,"Klaten, Kota Klaten, Magelang, Kota Magelang, Boyolali districts (Jawa Tengah province), Sleman district (Daerah Istimewa Yogyakarta province)",2010,10,24,2010,10,24,322,454
2010-0238-IDN,2010,Natural,Geophysical,Earthquake,,Indonesia,IDN,South-Eastern Asia,Yapen district (Papua province),2010,6,16,2010,6,16,17,
2010-0512-IDN,2010,Natural,Hydrological,Flood,,Indonesia,IDN,South-Eastern Asia,"Wasior I, Wasior II, Rado, Moru, Maniwak, Mangurrai, Wondamawi, Wondiboy villages (Telukwondama district, Papua Barat province)",2010,10,2,2010,10,6,291,3417
2010-0075-IDN,2010,Natural,Hydrological,Flood,,Indonesia,IDN,South-Eastern Asia,"Ciwidey village (Bandung district, Jawa Barat province)",2010,2,23,2010,3,1,44,
2010-0301-IDN,2010,Natural,Hydrological,Flood,,Indonesia,IDN,South-Eastern Asia,"Buru district (Maluku Utara province), Tanahlaut, Tanahbumbu districts (Kalimantan Selatan province)",2010,7,23,2010,7,25,21,7
2010-0563-IDN,2010,Natural,Geophysical,Earthquake,,Indonesia,IDN,South-Eastern Asia,Kepulauan Mentawai district (Sumatera Barat province),2010,10,25,2010,10,25,530,412
2010-0686-BGD,2010,Natural,Meteorological,Storm,,Bangladesh,BGD,Southern Asia,Mymensingh district (Dhaka province),2010,5,1,2010,5,2,15,50
2010-0269-BGD,2010,Natural,Hydrological,Flood,,Bangladesh,BGD,Southern Asia,"Netrakona district (Dhaka province), Kurigram, Gaibandha, Lalmonirhat districts (Rangpur province), Sylhet province",2010,6,24,2010,6,24,,
2010-0676-BGD,2010,Natural,Hydrological,Flood,,Bangladesh,BGD,Southern Asia,"Chittagong, Cox's Bazar, Feni, Lakshmipur, Noakhali districts (Chittagong province), Bagerhat, Khulna, Satkhira districts (Khulna province), Barisal province",2010,10,1,2010,10,12,15,
2010-0231-BGD,2010,Natural,Hydrological,Landslide,,Bangladesh,BGD,Southern Asia,"Cox's Bazar, Bandarban districts (Chittagong province)",2010,6,14,2010,6,15,66,100
2010-0171-BGD,2010,Natural,Meteorological,Storm,,Bangladesh,BGD,Southern Asia,"Rangpur, Dinajpur, Nilphamari, Lalmonirhat, Kurigram, Gaibandha districts (Rangpur province), Sirajganj, Bogra districts (Rajshahi province)",2010,4,13,2010,4,14,8,200
2010-0205-BGD,2010,Natural,Meteorological,Storm,,Bangladesh,BGD,Southern Asia,Lalmonirhat district (Rangpur province),2010,4,17,2010,4,17,3,
2010-0004-BGD,2010,Technological,Technological,Transport accident,,Bangladesh,BGD,Southern Asia,Kanaipur road,2010,1,1,2010,1,1,17,47
2010-0208-BGD,2010,Technological,Technological,Transport accident,Ferry,Bangladesh,BGD,Southern Asia,Sunamganj district,2010,6,8,2010,6,8,22,
2010-0631-BGD,2010,Technological,Technological,Transport accident,,Bangladesh,BGD,Southern Asia,Alipur,2010,12,18,2010,12,18,37,
2010-0644-BGD,2010,Technological,Technological,Industrial accident,Textil factory,Bangladesh,BGD,Southern Asia,Dacca,2010,12,14,2010,12,14,25,100
2010-0218-BGD,2010,Technological,Technological,Miscellaneous accident,Building,Bangladesh,BGD,Southern Asia,Dacca,2010,6,1,2010,6,1,25,25
2010-0085-BGD,2010,Technological,Technological,Miscellaneous accident,"Clothes factory ""Garib and Garib""",Bangladesh,BGD,Southern Asia,Gazipur,2010,2,25,2010,2,25,21,40
2010-0214-BGD,2010,Technological,Technological,Miscellaneous accident,Buildings,Bangladesh,BGD,Southern Asia,Kayettuli (Dacca),2010,6,3,2010,6,3,116,100
2010-0655-CAN,2010,Natural,Meteorological,Storm,,Canada,CAN,Northern America,"New Brunswick, Nova Scotia, Newfoundland and Labrador provinces",2010,12,26,2010,12,28,,
2010-0346-GIN,2010,Natural,Hydrological,Flood,,Guinea,GIN,Western Africa,Conakry province,2010,7,6,2010,7,6,7,
2010-0526-GIN,2010,Natural,Hydrological,Flood,,Guinea,GIN,Western Africa,"Mamou, Dounet towns (Mamou district, Mamou province), Labe town (Labe district, Labe province), Norassoba, Kouremale, Nounkounkan towns (Siguiri district, Kankan province), Lola town (Lola district, Nzerekore province)",2010,9,15,2010,9,18,1,6
2010-0614-GIN,2010,Technological,Technological,Transport accident,,Guinea,GIN,Western Africa,Near Coyah,2010,11,29,2010,11,29,19,9
2010-0446-IDN,2010,Natural,Geophysical,Volcanic activity,Mt. Sinabung,Indonesia,IDN,South-Eastern Asia,"Suka Meriah, Guru Kinayan, Gamber, Kuta Gugung, Siragong-Grang, Bekerah, Simacem, Sukanalu, Naman, Kebayaken, Kuta Rayat, Kuta Mbelin villages (Karo district, Sumatera Utara province)",2010,8,29,2010,9,7,1,1
2010-0034-IDN,2010,Natural,Hydrological,Flood,,Indonesia,IDN,South-Eastern Asia,Kolaka Utara district (Sulawasi Tenggara province),2010,1,22,2010,1,22,10,
2010-0576-IDN,2010,Natural,Hydrological,Flood,,Indonesia,IDN,South-Eastern Asia,"Toianas village (Timor Tengah Selatan district, Nusatenggara Timur province)",2010,11,2,2010,11,5,16,
2010-0026-IDN,2010,Natural,Hydrological,Flood,,Indonesia,IDN,South-Eastern Asia,Jawa Timur province,2010,1,11,2010,1,11,5,
2010-0684-IDN,2010,Natural,Hydrological,Flood,,Indonesia,IDN,South-Eastern Asia,Tabalong district (Kalimantan Selatan province),2010,9,11,2010,9,11,24,
2010-0533-IDN,2010,Natural,Hydrological,Landslide,,Indonesia,IDN,South-Eastern Asia,Sulawesi Tengah province,2010,10,12,2010,10,12,13,18
2010-0376-IDN,2010,Technological,Technological,Transport accident,,Indonesia,IDN,South-Eastern Asia,Flores Archipel,2010,8,9,2010,8,9,10,
2010-0558-IDN,2010,Technological,Technological,Transport accident,Ferry,Indonesia,IDN,South-Eastern Asia,Nusa Tengarra,2010,10,22,2010,10,22,22,
2010-0514-IDN,2010,Technological,Technological,Transport accident,,Indonesia,IDN,South-Eastern Asia,Petarukan Pemlang (Java),2010,10,2,2010,10,2,36,30
2010-0213-IDN,2010,Technological,Technological,Miscellaneous accident,Bridge,Indonesia,IDN,South-Eastern Asia,Sumatra Isl.,2010,6,6,2010,6,6,12,25
